{
  "licensing": {
    "canonical_license_package_id": "lcp-lt-0003",
    "official_review_source_url": "https://www.apache.org/licenses/LICENSE-2.0.txt",
    "scope_aware_code_license_qualified": "True",
    "scope_aware_data_license_qualified": "True",
    "scope_aware_model_level": "O3",
    "scope_aware_model_license_qualified": "True"
  },
  "licensing_profile": "O3",
  "model_id": "allenai/OLMo-2-0425-1B",
  "repository_revision": "a1847dff35000b4271fa70afc5db10fd29fedbdf",
  "resource_level": "L5",
  "resources": [
    {
      "aggregation_required": true,
      "evidence": [
        {
          "evidence_id": "hf_direct",
          "support_level": "direct"
        },
        {
          "evidence_id": "github_1",
          "support_level": "auxiliary"
        },
        {
          "evidence_id": "github_2",
          "support_level": "auxiliary"
        },
        {
          "evidence_id": "github_3",
          "support_level": "auxiliary"
        },
        {
          "evidence_id": "paper_1",
          "support_level": "auxiliary"
        },
        {
          "evidence_id": "web_page_1",
          "support_level": "auxiliary"
        },
        {
          "evidence_id": "web_page_2",
          "support_level": "auxiliary"
        },
        {
          "evidence_id": "web_page_3",
          "support_level": "auxiliary"
        },
        {
          "evidence_id": "web_page_4",
          "support_level": "auxiliary"
        },
        {
          "evidence_id": "web_page_5",
          "support_level": "auxiliary"
        },
        {
          "evidence_id": "web_page_6",
          "support_level": "auxiliary"
        },
        {
          "evidence_id": "web_page_7",
          "support_level": "auxiliary"
        }
      ],
      "field": "L1_weights",
      "label": "complete"
    },
    {
      "aggregation_required": true,
      "evidence": [
        {
          "evidence_id": "hf_direct",
          "support_level": "direct"
        },
        {
          "evidence_id": "github_1",
          "support_level": "strong"
        },
        {
          "evidence_id": "github_2",
          "support_level": "strong"
        },
        {
          "evidence_id": "github_3",
          "support_level": "strong"
        },
        {
          "evidence_id": "paper_1",
          "support_level": "strong"
        },
        {
          "evidence_id": "web_page_1",
          "support_level": "strong"
        },
        {
          "evidence_id": "web_page_2",
          "support_level": "strong"
        },
        {
          "evidence_id": "web_page_3",
          "support_level": "strong"
        },
        {
          "evidence_id": "web_page_4",
          "support_level": "strong"
        },
        {
          "evidence_id": "web_page_5",
          "support_level": "strong"
        },
        {
          "evidence_id": "web_page_6",
          "support_level": "strong"
        },
        {
          "evidence_id": "web_page_7",
          "support_level": "strong"
        }
      ],
      "field": "L1_config",
      "label": "complete"
    },
    {
      "aggregation_required": true,
      "evidence": [
        {
          "evidence_id": "hf_direct",
          "support_level": "direct"
        },
        {
          "evidence_id": "github_1",
          "support_level": "strong"
        },
        {
          "evidence_id": "github_2",
          "support_level": "strong"
        },
        {
          "evidence_id": "github_3",
          "support_level": "strong"
        },
        {
          "evidence_id": "paper_1",
          "support_level": "strong"
        },
        {
          "evidence_id": "web_page_1",
          "support_level": "strong"
        },
        {
          "evidence_id": "web_page_2",
          "support_level": "strong"
        },
        {
          "evidence_id": "web_page_3",
          "support_level": "strong"
        },
        {
          "evidence_id": "web_page_4",
          "support_level": "strong"
        },
        {
          "evidence_id": "web_page_5",
          "support_level": "strong"
        },
        {
          "evidence_id": "web_page_6",
          "support_level": "strong"
        },
        {
          "evidence_id": "web_page_7",
          "support_level": "strong"
        }
      ],
      "field": "L1_tokenizer",
      "label": "complete"
    },
    {
      "aggregation_required": true,
      "evidence": [
        {
          "evidence_id": "hf_direct",
          "support_level": "direct"
        },
        {
          "evidence_id": "github_1",
          "support_level": "strong"
        },
        {
          "evidence_id": "github_2",
          "support_level": "strong"
        },
        {
          "evidence_id": "github_3",
          "support_level": "strong"
        },
        {
          "evidence_id": "paper_1",
          "support_level": "strong"
        },
        {
          "evidence_id": "web_page_1",
          "support_level": "strong"
        },
        {
          "evidence_id": "web_page_2",
          "support_level": "strong"
        },
        {
          "evidence_id": "web_page_3",
          "support_level": "strong"
        },
        {
          "evidence_id": "web_page_4",
          "support_level": "strong"
        },
        {
          "evidence_id": "web_page_5",
          "support_level": "strong"
        },
        {
          "evidence_id": "web_page_6",
          "support_level": "strong"
        },
        {
          "evidence_id": "web_page_7",
          "support_level": "strong"
        }
      ],
      "field": "L1_infer_code",
      "label": "complete"
    },
    {
      "aggregation_required": true,
      "evidence": [
        {
          "evidence_id": "hf_direct",
          "support_level": "direct"
        },
        {
          "evidence_id": "github_1",
          "support_level": "strong"
        },
        {
          "evidence_id": "github_2",
          "support_level": "strong"
        },
        {
          "evidence_id": "github_3",
          "support_level": "strong"
        },
        {
          "evidence_id": "paper_1",
          "support_level": "strong"
        },
        {
          "evidence_id": "web_page_1",
          "support_level": "strong"
        },
        {
          "evidence_id": "web_page_2",
          "support_level": "strong"
        },
        {
          "evidence_id": "web_page_3",
          "support_level": "strong"
        },
        {
          "evidence_id": "web_page_4",
          "support_level": "strong"
        },
        {
          "evidence_id": "web_page_5",
          "support_level": "strong"
        },
        {
          "evidence_id": "web_page_6",
          "support_level": "strong"
        },
        {
          "evidence_id": "web_page_7",
          "support_level": "strong"
        }
      ],
      "field": "L1_infer_env",
      "label": "complete"
    },
    {
      "aggregation_required": true,
      "evidence": [
        {
          "evidence_id": "hf_direct",
          "support_level": "direct"
        },
        {
          "evidence_id": "github_1",
          "support_level": "strong"
        },
        {
          "evidence_id": "github_2",
          "support_level": "strong"
        },
        {
          "evidence_id": "github_3",
          "support_level": "strong"
        },
        {
          "evidence_id": "paper_1",
          "support_level": "strong"
        },
        {
          "evidence_id": "web_page_1",
          "support_level": "strong"
        },
        {
          "evidence_id": "web_page_2",
          "support_level": "strong"
        },
        {
          "evidence_id": "web_page_3",
          "support_level": "strong"
        },
        {
          "evidence_id": "web_page_4",
          "support_level": "strong"
        },
        {
          "evidence_id": "web_page_5",
          "support_level": "strong"
        },
        {
          "evidence_id": "web_page_6",
          "support_level": "strong"
        },
        {
          "evidence_id": "web_page_7",
          "support_level": "strong"
        }
      ],
      "field": "L2_principle",
      "label": "complete"
    },
    {
      "aggregation_required": true,
      "evidence": [
        {
          "evidence_id": "hf_direct",
          "support_level": "direct"
        },
        {
          "evidence_id": "github_1",
          "support_level": "strong"
        },
        {
          "evidence_id": "github_2",
          "support_level": "strong"
        },
        {
          "evidence_id": "github_3",
          "support_level": "strong"
        },
        {
          "evidence_id": "paper_1",
          "support_level": "strong"
        },
        {
          "evidence_id": "web_page_1",
          "support_level": "strong"
        },
        {
          "evidence_id": "web_page_2",
          "support_level": "strong"
        },
        {
          "evidence_id": "web_page_3",
          "support_level": "strong"
        },
        {
          "evidence_id": "web_page_4",
          "support_level": "strong"
        },
        {
          "evidence_id": "web_page_5",
          "support_level": "strong"
        },
        {
          "evidence_id": "web_page_6",
          "support_level": "strong"
        },
        {
          "evidence_id": "web_page_7",
          "support_level": "strong"
        }
      ],
      "field": "L2_training",
      "label": "complete"
    },
    {
      "aggregation_required": true,
      "evidence": [
        {
          "evidence_id": "hf_direct",
          "support_level": "direct"
        },
        {
          "evidence_id": "github_1",
          "support_level": "strong"
        },
        {
          "evidence_id": "github_2",
          "support_level": "strong"
        },
        {
          "evidence_id": "github_3",
          "support_level": "strong"
        },
        {
          "evidence_id": "paper_1",